{
  "$schema": "http://json-schema.org/draft-04/schema#",
  "type": "object",
  "title": "Parlamentswahlen",
  "properties": {
    "title": {
      "title": "Titel",
      "type": "string"
    },
    "subtitle": {
      "title": "Untertitel",
      "type": "string"
    },
    "threshold": {
      "title": "% Hürde",
      "description": "Falls eine % Hürde exisitert, bitte Prozentzahl eintragen",
      "type": "number"
    },
    "parties": {
      "title": "Parteien",
      "type": "array",
      "items": {
        "type": "object",
        "properties": {
          "name": {
            "title": "Parteiname",
            "type": "string"
          },
          "abbreviation": {
            "title": "Kürzel",
            "type": "string"
          },
          "color": {
            "title": "Farbe",
            "type": "object",
            "properties": {
              "colorCode": {
                "title": "Farbcode",
                "type": "string"
              },
              "classAttribute": {
                "title": "CSS Klassename",
                "type": "string"
              }
            }
          },
          "percentage": {
            "title": "Stimmen in %",
            "type": "number"
          },
          "previous": {
            "title": "Stimmen letzte Wahl in %",
            "type": "number"
          }
        }
      }
    },
    "notes": {
      "title": "Bemerkungen",
      "type": "string"
    },
    "sources": {
      "title": "Quellen",
      "type": "array",
      "items": {
        "type": "object",
        "properties": {
          "text": {
            "title": "Text",
            "type": "string"
          },
          "link": {
            "Q:type": "link",
            "title": "Link",
            "type": "object",
            "properties": {
              "url": {
                "title": "Url",
                "type": "string"
              },
              "isValid": {
                "type": "boolean"
              }    
            }
          }
        }
      }
    }
  },
  "required": [
    "title"
  ]
}
