{
  "title": "FIXTURE: results - long names - threshold - others - color codes",
  "sources": [
    {
      "text": "NZZ",
      "link": {
        "url": "https://nzz.ch",
        "isValid": true
      }
    }
  ],
  "subtitle": "Möglichkeit zusätzliche Informationen als Untertitel zu erfassen",
  "notes": "Jemand musste Josef's K. verleumdet haben, denn ohne dass er etwas Böses getan hätte, wurde er eines Morgens verhaftet.",
  "threshold": 0.67,
  "parties": [
    {
      "name": "Socialistische Partij",
      "color": {
        "colorCode": "#8440a3"
      },
      "previous": 9.6,
      "percentage": 9.2
    },
    {
      "name": "Partij van de Arbeid",
      "color": {
        "colorCode": "#c31906"
      },
      "previous": 24.8,
      "percentage": 5.7
    },
    {
      "name": "GroenLinks",
      "color": {
        "colorCode": "#66a622"
      },
      "previous": 2.3,
      "percentage": 8.9
    },
    {
      "name": "Democraten 66",
      "color": {
        "colorCode": "#22a682"
      },
      "previous": 8,
      "percentage": 12
    },
    {
      "name": "ChristenUnie",
      "color": {
        "colorCode": "#0084c7"
      },
      "previous": 3.1,
      "percentage": 3.4
    },
    {
      "name": "Christen-Democratisch Appèl",
      "color": {
        "colorCode": "#01b1c0"
      },
      "previous": 8.5,
      "percentage": 12.5
    },
    {
      "name": "Volkspartij voor Vrijheid en Democratie",
      "color": {
        "colorCode": "#d28b00"
      },
      "previous": 26.5,
      "percentage": 21.3
    },
    {
      "name": "Partij voor de Vrijheid",
      "color": {
        "colorCode": "#0a0a0a"
      },
      "previous": 10.1,
      "percentage": 13.1
    },
    {
      "name": "andere",
      "color": {
        "colorCode": "#616161"
      },
      "previous": 6.7,
      "percentage": 13.6
    }
  ]
}
